headline,date,doc_type,material_type,section,keywords
BUSINESS DIGEST,1992-06-27,article,Summary,,['NO INDEX TERMS']
BUSINESS DIGEST,1992-06-20,article,Summary,,['NO INDEX TERMS']
Mutual Funds; Bright Spots in a Dim First Half,1992-06-28,article,News,,"['Stocks and Bonds', 'STOCK PRICES AND TRADING VOLUME']"
Put Trust In the Tried And True,1992-06-06,article,,,[]
Commemorating A Church's History,1992-06-21,article,News,,['Numismatics']
Fantasies and Practicalities to Lift Fashion's Mood; Prints Turn Up in Surprising Places,1992-06-02,article,News,,['APPAREL']
Classic Hearts and Imperishable Beans,1992-06-23,article,Biography,,"['Jewels and Jewelry', 'Design']"
"Exotic?Yes, But Safety Is Optional",1992-06-13,article,,,[]
BUSINESS DIGEST,1992-06-06,article,Summary,,['NO INDEX TERMS']
By Design; Buckle Up for the Year of the Belt,1992-06-16,article,News,,['TERMS NOT AVAILABLE']
