headline,date,doc_type,material_type,section,keywords
A City Where Chinese Artists Hope to Strike Gold,2010-10-08,article,News,,['Art']
Testing the Limits of Loose Money,2010-10-11,article,News,,"['US Dollar (Currency)', 'International Trade and World Market']"
Blazing Three Trails to Red-Hot Sectors,2010-10-09,article,News,,"['Metals and Minerals', 'Mutual Funds', 'Stocks and Bonds', 'Mines and Mining']"
Five-Star Accommodations in the Touring Class,2010-10-22,article,Review,,"['Reviews', 'Motorcycles, Motor Bikes and Motorscooters']"
A Basket of Assets in One Investment,2010-10-20,article,News,,"['High Net Worth Individuals', 'Stocks and Bonds', 'Exchange Traded Funds']"
Now Sparkling | Ralph Lauren’s Fine Jewelry,2010-10-18,article,,,[]
Standard 41 Introduces a Line of ‘Taibles’ and Seating,2010-10-06,article,News,,['Tables']
Coping With Economic Uncertainty,2010-10-18,article,,,[]
Iranian Officials Warn of Unrest Tied to Subsidy Cuts,2010-10-11,article,News,,"['Politics and Government', 'Economic Conditions and Trends', 'Prices (Fares, Fees and Rates)']"
"In Bond Frenzy, Investors Bet on Inflation",2010-10-26,article,News,,"['United States Economy', 'Government Bonds', 'Inflation (Economics)']"
